{
  "document_id": "123e4567-e89b-12d3-a456-426614174000",
  "doc_type": "passport_bio",
  "pages": [
    {
      "page_no": 1,
      "width": 2550,
      "height": 3300,
      "full_text": "P<UTOERIKSSON<<ANNA<MARIA<<<<<<<<<<<<<<<<<<<",
      "elements": [
        {
          "type": "text",
          "bbox": [120, 200, 780, 260],
          "text": "ERIKSSON",
          "confidence": 0.95,
          "reading_order_index": 0
        },
        {
          "type": "mrz",
          "bbox": [100, 2800, 2400, 3200],
          "text": "P<UTOERIKSSON<<ANNA<MARIA<<<<<<<<<<<<<<<<<<<",
          "confidence": 0.92,
          "reading_order_index": 1
        }
      ]
    }
  ],
  "metadata": {
    "layout_model": "paddleocr-pp-structure",
    "ocr_model": "paddleocr",
    "created_at": "2024-07-17T12:00:00Z",
    "warnings": []
  }
}
